{
  "$id": "https://aecctx.dev/schemas/v0.2/provider-response.schema.json",
  "$schema": "https://json-schema.org/draft/2020-12/schema",
  "$defs": {
    "capability": {
      "additionalProperties": false,
      "properties": {
        "affected": {"items": {"type": "string"}, "type": "array"},
        "fallback": {"minLength": 1, "type": "string"},
        "reason_codes": {"items": {"minLength": 1, "type": "string"}, "type": "array", "uniqueItems": true},
        "support_level": {"enum": ["full", "partial", "opaque", "unsupported"]}
      },
      "required": ["support_level", "reason_codes", "affected", "fallback"],
      "type": "object"
    }
  },
  "additionalProperties": false,
  "properties": {
    "artifacts": {
      "items": {
        "additionalProperties": false,
        "properties": {
          "bytes": {"minimum": 0, "type": "integer"},
          "media_type": {"minLength": 1, "type": "string"},
          "path": {"pattern": "^artifacts/(?!.*(?:^|/)\\.\\.(?:/|$)).+", "type": "string"},
          "sha256": {"pattern": "^[0-9a-f]{64}$", "type": "string"}
        },
        "required": ["path", "sha256", "bytes", "media_type"],
        "type": "object"
      },
      "type": "array"
    },
    "attestation": {
      "additionalProperties": false,
      "properties": {
        "descriptor_digest": {"pattern": "^[0-9a-f]{64}$", "type": "string"},
        "deterministic": {"type": "boolean"},
        "enforcement_profile": {"minLength": 1, "type": "string"},
        "network_mode": {"enum": ["disabled", "allowlisted"]},
        "provider_id": {"minLength": 1, "type": "string"},
        "provider_version": {"minLength": 1, "type": "string"},
        "request_digest": {"pattern": "^[0-9a-f]{64}$", "type": "string"},
        "response_payload_digest": {"pattern": "^[0-9a-f]{64}$", "type": "string"},
        "runtime_version": {"minLength": 1, "type": "string"}
        ,"runtime_digest": {"pattern": "^sha256:[0-9a-f]{64}$", "type": "string"}
      },
      "required": ["provider_id", "provider_version", "runtime_version", "runtime_digest", "enforcement_profile", "network_mode", "deterministic", "descriptor_digest", "request_digest", "response_payload_digest"],
      "type": "object"
    },
    "capability_report": {"additionalProperties": {"$ref": "#/$defs/capability"}, "minProperties": 1, "type": "object"},
    "diagnostics": {"items": {"type": "object"}, "type": "array"},
    "error": {
      "additionalProperties": false,
      "properties": {"code": {"minLength": 1, "type": "string"}, "message": {"minLength": 1, "type": "string"}},
      "required": ["code", "message"],
      "type": "object"
    },
    "events": {
      "items": {
        "additionalProperties": false,
        "properties": {
          "event_type": {"enum": ["container", "primitive", "assertion", "entity", "relation", "artifact", "diagnostic", "unsupported"]},
          "payload": {"type": "object"},
          "sequence": {"minimum": 0, "type": "integer"},
          "source_locator": {"minLength": 1, "type": "string"}
        },
        "required": ["sequence", "event_type", "source_locator", "payload"],
        "type": "object"
      },
      "type": "array"
    },
    "ok": {"type": "boolean"},
    "protocol_version": {"const": "0.2"},
    "provider_id": {"minLength": 1, "type": "string"},
    "request_id": {"pattern": "^[0-9a-f]{64}$", "type": "string"},
    "resource_usage": {"type": "object"}
  },
  "required": ["protocol_version", "request_id", "provider_id", "ok", "events", "artifacts", "diagnostics", "capability_report", "resource_usage", "attestation"],
  "title": "AECCTX v0.2 external provider response",
  "type": "object"
}
