{"artifacts":[{"bytes":43082,"media_type":"application/vnd.aecctx.libredwg+json","path":"artifacts/source.json","sha256":"190545218aed4766e0d477720362098f56c41f9279c200cd2750a5674bd32183"},{"bytes":21681,"media_type":"application/dxf","path":"artifacts/converted-r2000.dxf","sha256":"9f86d16181606a3deb2e8ae1f5a1cb95c68885e2ee3e83d180940732d9a92ffc"}],"attestation":{"descriptor_digest":"a0031e0c71ffc545448d0e5743bc8f39711c72924f92c5dd1b61ec7b1d450389","deterministic":true,"enforcement_profile":"oci-docker-v1","network_mode":"disabled","provider_id":"org.aecctx.dwg.libredwg","provider_version":"0.2.0","request_digest":"6404b2312cb9a837e0aacedb9399e8f7b340e9f9a1996b2e2d03c2fe87b2f706","response_payload_digest":"d9ededcff7819c9e4b673c7a59decb69036e7aac5ee2b02d70b1dfbf830dff81","runtime_digest":"sha256:bb237d62599b5204b550fb075ee9f738e4198e031b71f3a6d7f85eae07c0c7c1","runtime_version":"python-3.12+libredwg-0.13.4-api1"},"capability_report":{"2d_geometry":{"affected":["dwg-source"],"fallback":"retain observed source objects and converted DXF evidence","reason_codes":["AECCTX_DWG_CONVERTED_DXF_EVIDENCE"],"support_level":"partial"},"3d_geometry":{"affected":["dwg-source"],"fallback":"retain opaque source evidence","reason_codes":["AECCTX_DWG_CAPABILITY_UNSUPPORTED"],"support_level":"unsupported"},"georeferencing":{"affected":["dwg-source"],"fallback":"retain opaque source evidence","reason_codes":["AECCTX_DWG_CAPABILITY_UNSUPPORTED"],"support_level":"unsupported"},"hierarchy":{"affected":["dwg-source"],"fallback":"retain opaque source evidence","reason_codes":["AECCTX_DWG_CAPABILITY_UNSUPPORTED"],"support_level":"unsupported"},"identity":{"affected":["dwg-source"],"fallback":"retain observed source objects and converted DXF evidence","reason_codes":["AECCTX_DWG_CONVERTED_DXF_EVIDENCE","AECCTX_DWG_HANDLE_CONFLICT"],"support_level":"partial"},"materials_styles":{"affected":["dwg-source"],"fallback":"retain observed source objects and converted DXF evidence","reason_codes":["AECCTX_DWG_CONVERTED_DXF_EVIDENCE"],"support_level":"partial"},"properties":{"affected":["dwg-source"],"fallback":"retain observed source objects and converted DXF evidence","reason_codes":["AECCTX_DWG_CONVERTED_DXF_EVIDENCE"],"support_level":"partial"},"relationships":{"affected":["dwg-source"],"fallback":"retain observed source objects and converted DXF evidence","reason_codes":["AECCTX_DWG_CONVERTED_DXF_EVIDENCE","AECCTX_DWG_HANDLE_CONFLICT"],"support_level":"partial"},"text":{"affected":["dwg-source"],"fallback":"retain observed source objects and converted DXF evidence","reason_codes":["AECCTX_DWG_CONVERTED_DXF_EVIDENCE"],"support_level":"partial"},"validation":{"affected":["dwg-source"],"fallback":"retain observed source objects and converted DXF evidence","reason_codes":["AECCTX_DWG_CONVERTED_DXF_EVIDENCE"],"support_level":"partial"}},"diagnostics":[{"code":"AECCTX_DWG_HANDLE_CONFLICT","severity":"warning"},{"code":"AECCTX_DWG_LIBREDWG_DIAGNOSTIC_RETAINED","severity":"info"}],"events":[{"event_type":"primitive","payload":{"artifact_path":"artifacts/source.json","artifact_sha256":"190545218aed4766e0d477720362098f56c41f9279c200cd2750a5674bd32183","dwg_version":"AC1015","handle_conflicts":["1F","B"],"input_sha256":"fe9e07cabc83eb99c3c2334d5503fbcc9ebe0f94d349581ee559d57d6a30c494","object_count":82,"schema":"aecctx.dwg.source.v1"},"sequence":0,"source_locator":"sha256:fe9e07cabc83eb99c3c2334d5503fbcc9ebe0f94d349581ee559d57d6a30c494"},{"event_type":"primitive","payload":{"artifact_path":"artifacts/converted-r2000.dxf","artifact_sha256":"9f86d16181606a3deb2e8ae1f5a1cb95c68885e2ee3e83d180940732d9a92ffc","converter":"LibreDWG dwgread 0.13.4","dxf_version":"AC1015","input_sha256":"fe9e07cabc83eb99c3c2334d5503fbcc9ebe0f94d349581ee559d57d6a30c494","representation_fidelity":"converted","schema":"aecctx.dwg.conversion.v1"},"sequence":1,"source_locator":"dwg-artifact:converted-dxf:sha256:9f86d16181606a3deb2e8ae1f5a1cb95c68885e2ee3e83d180940732d9a92ffc"}],"ok":true,"protocol_version":"0.2","provider_id":"org.aecctx.dwg.libredwg","request_id":"bb8c2675583870cdfbf299bca35b6aa7c7184616167e8aab946adcae81d4bb3b","resource_usage":{"artifacts":2,"events":2,"source_objects":82}}