{"artifacts":[],"attestation":{"descriptor_digest":"31234009075f195e1ca7f093bf93f70b72ce3d31f693641a336c7b28aa04b5fb","deterministic":true,"enforcement_profile":"oci-docker-v1","network_mode":"disabled","provider_id":"org.aecctx.vision.raster-rules","provider_version":"0.3.0","request_digest":"77a3d8c134ade56e3347ae3f4a4459c232d640e74744efa1ae9b15fd8b87c72a","response_payload_digest":"377cc7dfa75bfb33383724846557f7906233295548f24e466d9fc60baaf31160","runtime_digest":"sha256:fd95fa221297a88e1cf49c55ec1828edd7c5a428187e67b5d1805692d11588db","runtime_version":"python-3.12.10-stdlib-raster-rules-v1"},"capability_report":{"2d_geometry":{"affected":[],"fallback":"source pixels","reason_codes":["AECCTX_VISION_INFERRED_ONLY"],"support_level":"partial"},"3d_geometry":{"affected":["visible-raster"],"fallback":"retain source pixels","reason_codes":["AECCTX_VISION_CAPABILITY_UNSUPPORTED"],"support_level":"unsupported"},"georeferencing":{"affected":["visible-raster"],"fallback":"retain source pixels","reason_codes":["AECCTX_VISION_CAPABILITY_UNSUPPORTED"],"support_level":"unsupported"},"hierarchy":{"affected":["visible-raster"],"fallback":"retain source pixels","reason_codes":["AECCTX_VISION_CAPABILITY_UNSUPPORTED"],"support_level":"unsupported"},"identity":{"affected":["visible-raster"],"fallback":"retain source pixels","reason_codes":["AECCTX_VISION_CAPABILITY_UNSUPPORTED"],"support_level":"unsupported"},"materials_styles":{"affected":["visible-raster"],"fallback":"retain source pixels","reason_codes":["AECCTX_VISION_CAPABILITY_UNSUPPORTED"],"support_level":"unsupported"},"properties":{"affected":["visible-raster"],"fallback":"retain source pixels","reason_codes":["AECCTX_VISION_CAPABILITY_UNSUPPORTED"],"support_level":"unsupported"},"relationships":{"affected":[],"fallback":"source pixels","reason_codes":["AECCTX_VISION_INFERRED_ONLY"],"support_level":"partial"},"text":{"affected":["visible-raster"],"fallback":"retain source pixels","reason_codes":["AECCTX_VISION_CAPABILITY_UNSUPPORTED"],"support_level":"unsupported"},"validation":{"affected":["visible-raster"],"fallback":"retain source pixels","reason_codes":["AECCTX_VISION_CAPABILITY_UNSUPPORTED"],"support_level":"unsupported"}},"diagnostics":[],"events":[{"event_type":"primitive","payload":{"candidates":[{"bbox":[3,3,22,22],"confidence":1.0,"id":"c0","kind":"region.rectangle","pixel_count":84,"state":"candidate"},{"bbox":[80,5,21,21],"confidence":1.0,"id":"c1","kind":"table.grid","pixel_count":117,"state":"candidate"},{"bbox":[35,9,7,7],"confidence":1.0,"id":"c2","kind":"symbol.cross","pixel_count":13,"state":"candidate"},{"bbox":[50,10,20,5],"confidence":1.0,"id":"c3","kind":"dimension.linear","pixel_count":28,"state":"candidate"}],"height":96,"profile":"visible-raster-rules-v1","reconstructions":[{"confidence":1.0,"id":"h0","kind":"reconstruction.planar-boundary","pixel_polygon":[[3,3],[24,3],[24,24],[3,24],[3,3]],"source_candidate_ids":["c0"]}],"relationships":[],"schema":"aecctx.vision.candidates.v1","width":128},"sequence":0,"source_locator":"sha256:1ee979b4eab1a50c1266f5c0547ceabc1c39610c03e48e9eebd46c9b9ba1fd61"}],"ok":true,"protocol_version":"0.2","provider_id":"org.aecctx.vision.raster-rules","request_id":"da73511d134b8997b04ada20262ce1b26ffd55f8df0addf4d00aaba1d3e1685d","resource_usage":{"artifacts":0,"events":1}}
