{"artifacts":[],"attestation":{"descriptor_digest":"78239a9154f15cb0de75382836fe56d3fe9511566c69d694b5821e4e3e4fadf5","deterministic":true,"enforcement_profile":"oci-docker-v1","network_mode":"disabled","provider_id":"org.aecctx.ocr.tesseract-tsv","provider_version":"0.3.0","request_digest":"0cbe095f2d7f94b8792c95d7277a3929bdde1bc988e59f8fe962dce892157bac","response_payload_digest":"2914cc91a9b137ad5221896bc0508ca11dcc00c0e5e08cb7ecc1705f82dc7058","runtime_digest":"sha256:73de5713dfa61b9da97576d05bdf2180fa32a0d9edc8293eb92ae9f568521cff","runtime_version":"tesseract-5.3.4+capi+eng+spa+por"},"capability_report":{"2d_geometry":{"affected":["raster-input"],"fallback":"retain opaque source evidence","reason_codes":["AECCTX_OCR_CAPABILITY_UNSUPPORTED"],"support_level":"unsupported"},"3d_geometry":{"affected":["raster-input"],"fallback":"retain opaque source evidence","reason_codes":["AECCTX_OCR_CAPABILITY_UNSUPPORTED"],"support_level":"unsupported"},"georeferencing":{"affected":["raster-input"],"fallback":"retain opaque source evidence","reason_codes":["AECCTX_OCR_CAPABILITY_UNSUPPORTED"],"support_level":"unsupported"},"hierarchy":{"affected":["raster-input"],"fallback":"retain opaque source evidence","reason_codes":["AECCTX_OCR_CAPABILITY_UNSUPPORTED"],"support_level":"unsupported"},"identity":{"affected":["raster-input"],"fallback":"retain opaque source evidence","reason_codes":["AECCTX_OCR_CAPABILITY_UNSUPPORTED"],"support_level":"unsupported"},"materials_styles":{"affected":["raster-input"],"fallback":"retain opaque source evidence","reason_codes":["AECCTX_OCR_CAPABILITY_UNSUPPORTED"],"support_level":"unsupported"},"properties":{"affected":["raster-input"],"fallback":"retain opaque source evidence","reason_codes":["AECCTX_OCR_CAPABILITY_UNSUPPORTED"],"support_level":"unsupported"},"relationships":{"affected":["raster-input"],"fallback":"retain opaque source evidence","reason_codes":["AECCTX_OCR_CAPABILITY_UNSUPPORTED"],"support_level":"unsupported"},"text":{"affected":["raster-word-evidence"],"fallback":"retain source pixels and provider attestation","reason_codes":["AECCTX_OCR_INFERRED_UNVERIFIED"],"support_level":"partial"},"validation":{"affected":[],"fallback":"none","reason_codes":[],"support_level":"full"}},"diagnostics":[],"events":[{"event_type":"primitive","payload":{"blocks":[{"bbox":[31,37,356,26],"block":1,"id":"b0","line_ids":["l0"]}],"height":240,"language":"spa","lines":[{"bbox":[31,37,356,26],"block":1,"id":"l0","line":1,"paragraph":1,"word_ids":["w0","w1","w2"]}],"orientation_degrees":0,"page_segmentation_mode":6,"profile":"spa-block-v1","reading_order":{"state":"known","value":"tsv-hierarchy"},"schema":"aecctx.ocr.layout.v1","tables":[],"width":640,"words":[{"bbox":[31,40,111,18],"block":1,"confidence":96.679749,"id":"w0","line":1,"paragraph":1,"reading_order":0,"text":"contexto","word":1},{"bbox":[149,38,99,25],"block":1,"confidence":96.59034,"id":"w1","line":1,"paragraph":1,"reading_order":1,"text":"espanol","word":2},{"bbox":[255,37,132,21],"block":1,"confidence":96.616867,"id":"w2","line":1,"paragraph":1,"reading_order":2,"text":"verificable","word":3}]},"sequence":0,"source_locator":"sha256:f19db1b96f2e570a557070f5ffc9e366079289c9b741fbedc1f765c8d22ab11c"}],"ok":true,"protocol_version":"0.2","provider_id":"org.aecctx.ocr.tesseract-tsv","request_id":"5d877dda25a94cac573c1bd622802f3d648b54a5adbfc381a6d1cdf8427055c0","resource_usage":{"artifacts":0,"events":1,"height":240,"width":640}}
