{
  "artifacts": [
    {
      "bytes": 30813,
      "media_type": "application/vnd.aecctx.libredwg+json",
      "path": "artifacts/source.json",
      "sha256": "6ef9f9c9d3537339420fa35a290832eaad57cea723821bc2d1fbabc4fbb2548d"
    },
    {
      "bytes": 17196,
      "media_type": "application/dxf",
      "path": "artifacts/converted.dxf",
      "sha256": "152fff3124e23b9515c76e49f608381856c41e50ae050f14569e0a736b317808"
    }
  ],
  "attestation": {
    "descriptor_digest": "b12abfc15a54811faf9ab7dc6cb5887ac5018b261d698e68bca57e653fa0412a",
    "deterministic": true,
    "enforcement_profile": "oci-docker-v1",
    "network_mode": "disabled",
    "provider_id": "org.aecctx.dwg.libredwg",
    "provider_version": "0.3.0",
    "request_digest": "3cc493771e07d16c0249334831c15f8fe3ef4d1a0912679c31454a90cdb46e38",
    "response_payload_digest": "aa6b7a551ed7c2091cb6d01e5f216209e770789b1e37ced0d5681b7c290d3949",
    "runtime_digest": "sha256:bb237d62599b5204b550fb075ee9f738e4198e031b71f3a6d7f85eae07c0c7c1",
    "runtime_version": "python-3.12+libredwg-0.13.4-api1"
  },
  "capability_report": {
    "2d_geometry": {
      "affected": [
        "dwg-source"
      ],
      "fallback": "retain observed source objects and converted DXF evidence",
      "reason_codes": [
        "AECCTX_DWG_CONVERTED_DXF_EVIDENCE"
      ],
      "support_level": "partial"
    },
    "3d_geometry": {
      "affected": [
        "dwg-source"
      ],
      "fallback": "retain observed source objects and converted DXF evidence",
      "reason_codes": [
        "AECCTX_DWG_CONVERTED_DXF_EVIDENCE"
      ],
      "support_level": "partial"
    },
    "georeferencing": {
      "affected": [
        "dwg-source"
      ],
      "fallback": "retain opaque source evidence",
      "reason_codes": [
        "AECCTX_DWG_CAPABILITY_UNSUPPORTED"
      ],
      "support_level": "unsupported"
    },
    "hierarchy": {
      "affected": [
        "dwg-source"
      ],
      "fallback": "retain opaque source evidence",
      "reason_codes": [
        "AECCTX_DWG_CAPABILITY_UNSUPPORTED"
      ],
      "support_level": "unsupported"
    },
    "identity": {
      "affected": [
        "dwg-source"
      ],
      "fallback": "retain observed source objects and converted DXF evidence",
      "reason_codes": [
        "AECCTX_DWG_CONVERTED_DXF_EVIDENCE",
        "AECCTX_DWG_HANDLE_CONFLICT"
      ],
      "support_level": "partial"
    },
    "materials_styles": {
      "affected": [
        "dwg-source"
      ],
      "fallback": "retain observed source objects and converted DXF evidence",
      "reason_codes": [
        "AECCTX_DWG_CONVERTED_DXF_EVIDENCE"
      ],
      "support_level": "partial"
    },
    "properties": {
      "affected": [
        "dwg-source"
      ],
      "fallback": "retain observed source objects and converted DXF evidence",
      "reason_codes": [
        "AECCTX_DWG_CONVERTED_DXF_EVIDENCE"
      ],
      "support_level": "partial"
    },
    "relationships": {
      "affected": [
        "dwg-source"
      ],
      "fallback": "retain observed source objects and converted DXF evidence",
      "reason_codes": [
        "AECCTX_DWG_CONVERTED_DXF_EVIDENCE",
        "AECCTX_DWG_HANDLE_CONFLICT"
      ],
      "support_level": "partial"
    },
    "text": {
      "affected": [
        "dwg-source"
      ],
      "fallback": "retain observed source objects and converted DXF evidence",
      "reason_codes": [
        "AECCTX_DWG_CONVERTED_DXF_EVIDENCE"
      ],
      "support_level": "partial"
    },
    "validation": {
      "affected": [
        "dwg-source"
      ],
      "fallback": "retain observed source objects and converted DXF evidence",
      "reason_codes": [
        "AECCTX_DWG_CONVERTED_DXF_EVIDENCE"
      ],
      "support_level": "partial"
    }
  },
  "diagnostics": [
    {
      "code": "AECCTX_DWG_HANDLE_CONFLICT",
      "severity": "warning"
    },
    {
      "code": "AECCTX_DWG_LIBREDWG_DIAGNOSTIC_RETAINED",
      "severity": "info"
    }
  ],
  "events": [
    {
      "event_type": "primitive",
      "payload": {
        "artifact_path": "artifacts/source.json",
        "artifact_sha256": "6ef9f9c9d3537339420fa35a290832eaad57cea723821bc2d1fbabc4fbb2548d",
        "dwg_version": "AC1015",
        "handle_conflicts": [
          "1F",
          "B"
        ],
        "input_sha256": "d5a3a31bc1327cd76b54f8f3ac55503d3ab8ec27da02987c2f422dfd5860cf72",
        "object_count": 58,
        "profile": "acx33-r2000-v1",
        "schema": "aecctx.dwg.source.v2",
        "units": {
          "code": 6,
          "state": "known",
          "symbol": "m"
        },
        "unsupported_classes": []
      },
      "sequence": 0,
      "source_locator": "sha256:d5a3a31bc1327cd76b54f8f3ac55503d3ab8ec27da02987c2f422dfd5860cf72"
    },
    {
      "event_type": "primitive",
      "payload": {
        "artifact_path": "artifacts/converted.dxf",
        "artifact_sha256": "152fff3124e23b9515c76e49f608381856c41e50ae050f14569e0a736b317808",
        "conversion_losses": [],
        "converter": "LibreDWG dwgread 0.13.4",
        "input_sha256": "d5a3a31bc1327cd76b54f8f3ac55503d3ab8ec27da02987c2f422dfd5860cf72",
        "observed_dxf_version": "AC1015",
        "profile": "acx33-r2000-v1",
        "representation_fidelity": "converted",
        "requested_dxf_version": "AC1015",
        "schema": "aecctx.dwg.conversion.v2"
      },
      "sequence": 1,
      "source_locator": "dwg-artifact:converted-dxf:sha256:152fff3124e23b9515c76e49f608381856c41e50ae050f14569e0a736b317808"
    }
  ],
  "ok": true,
  "protocol_version": "0.2",
  "provider_id": "org.aecctx.dwg.libredwg",
  "request_id": "bb8888014ddc9073c9647325219e0e2ea62a1fbb476761eecb658e4d0dda1d48",
  "resource_usage": {
    "artifacts": 2,
    "events": 2,
    "source_objects": 58
  }
}
