{
  "artifacts": [
    {
      "bytes": 30812,
      "media_type": "application/vnd.aecctx.libredwg+json",
      "path": "artifacts/source.json",
      "sha256": "5c9d7dbaf8d800399ae693a2ba5b8f9e3b67713bfdb92b78bdba580dbf365bc2"
    },
    {
      "bytes": 17194,
      "media_type": "application/dxf",
      "path": "artifacts/converted.dxf",
      "sha256": "d668789efac18692f23f3ae1c58347b958c38a6822fafc2cae07e4f3c12205a7"
    }
  ],
  "attestation": {
    "descriptor_digest": "b12abfc15a54811faf9ab7dc6cb5887ac5018b261d698e68bca57e653fa0412a",
    "deterministic": true,
    "enforcement_profile": "oci-docker-v1",
    "network_mode": "disabled",
    "provider_id": "org.aecctx.dwg.libredwg",
    "provider_version": "0.3.0",
    "request_digest": "5b58ff18fb066c3062039eb249a56cafc767902f0b1c1d195bbebfcdf0626156",
    "response_payload_digest": "11340f1f87cbeae3a874f590d75b642fbd64a2ea18e1125cb574903ac3846061",
    "runtime_digest": "sha256:bb237d62599b5204b550fb075ee9f738e4198e031b71f3a6d7f85eae07c0c7c1",
    "runtime_version": "python-3.12+libredwg-0.13.4-api1"
  },
  "capability_report": {
    "2d_geometry": {
      "affected": [
        "dwg-source"
      ],
      "fallback": "retain observed source objects and converted DXF evidence",
      "reason_codes": [
        "AECCTX_DWG_CONVERTED_DXF_EVIDENCE"
      ],
      "support_level": "partial"
    },
    "3d_geometry": {
      "affected": [
        "dwg-source"
      ],
      "fallback": "retain observed source objects and converted DXF evidence",
      "reason_codes": [
        "AECCTX_DWG_CONVERTED_DXF_EVIDENCE"
      ],
      "support_level": "partial"
    },
    "georeferencing": {
      "affected": [
        "dwg-source"
      ],
      "fallback": "retain opaque source evidence",
      "reason_codes": [
        "AECCTX_DWG_CAPABILITY_UNSUPPORTED"
      ],
      "support_level": "unsupported"
    },
    "hierarchy": {
      "affected": [
        "dwg-source"
      ],
      "fallback": "retain opaque source evidence",
      "reason_codes": [
        "AECCTX_DWG_CAPABILITY_UNSUPPORTED"
      ],
      "support_level": "unsupported"
    },
    "identity": {
      "affected": [
        "dwg-source"
      ],
      "fallback": "retain observed source objects and converted DXF evidence",
      "reason_codes": [
        "AECCTX_DWG_CONVERTED_DXF_EVIDENCE",
        "AECCTX_DWG_HANDLE_CONFLICT"
      ],
      "support_level": "partial"
    },
    "materials_styles": {
      "affected": [
        "dwg-source"
      ],
      "fallback": "retain observed source objects and converted DXF evidence",
      "reason_codes": [
        "AECCTX_DWG_CONVERTED_DXF_EVIDENCE"
      ],
      "support_level": "partial"
    },
    "properties": {
      "affected": [
        "dwg-source"
      ],
      "fallback": "retain observed source objects and converted DXF evidence",
      "reason_codes": [
        "AECCTX_DWG_CONVERTED_DXF_EVIDENCE"
      ],
      "support_level": "partial"
    },
    "relationships": {
      "affected": [
        "dwg-source"
      ],
      "fallback": "retain observed source objects and converted DXF evidence",
      "reason_codes": [
        "AECCTX_DWG_CONVERTED_DXF_EVIDENCE",
        "AECCTX_DWG_HANDLE_CONFLICT"
      ],
      "support_level": "partial"
    },
    "text": {
      "affected": [
        "dwg-source"
      ],
      "fallback": "retain observed source objects and converted DXF evidence",
      "reason_codes": [
        "AECCTX_DWG_CONVERTED_DXF_EVIDENCE"
      ],
      "support_level": "partial"
    },
    "validation": {
      "affected": [
        "dwg-source"
      ],
      "fallback": "retain observed source objects and converted DXF evidence",
      "reason_codes": [
        "AECCTX_DWG_CONVERTED_DXF_EVIDENCE"
      ],
      "support_level": "partial"
    }
  },
  "diagnostics": [
    {
      "code": "AECCTX_DWG_HANDLE_CONFLICT",
      "severity": "warning"
    },
    {
      "code": "AECCTX_DWG_LIBREDWG_DIAGNOSTIC_RETAINED",
      "severity": "info"
    }
  ],
  "events": [
    {
      "event_type": "primitive",
      "payload": {
        "artifact_path": "artifacts/source.json",
        "artifact_sha256": "5c9d7dbaf8d800399ae693a2ba5b8f9e3b67713bfdb92b78bdba580dbf365bc2",
        "dwg_version": "AC1015",
        "handle_conflicts": [
          "1F",
          "B"
        ],
        "input_sha256": "37468865d8b504ea4c94bee4da859ecc07a982e576cd5d014b1f8003d4c285a5",
        "object_count": 58,
        "profile": "acx33-r2000-v1",
        "schema": "aecctx.dwg.source.v2",
        "units": {
          "code": 4,
          "state": "known",
          "symbol": "mm"
        },
        "unsupported_classes": []
      },
      "sequence": 0,
      "source_locator": "sha256:37468865d8b504ea4c94bee4da859ecc07a982e576cd5d014b1f8003d4c285a5"
    },
    {
      "event_type": "primitive",
      "payload": {
        "artifact_path": "artifacts/converted.dxf",
        "artifact_sha256": "d668789efac18692f23f3ae1c58347b958c38a6822fafc2cae07e4f3c12205a7",
        "conversion_losses": [],
        "converter": "LibreDWG dwgread 0.13.4",
        "input_sha256": "37468865d8b504ea4c94bee4da859ecc07a982e576cd5d014b1f8003d4c285a5",
        "observed_dxf_version": "AC1015",
        "profile": "acx33-r2000-v1",
        "representation_fidelity": "converted",
        "requested_dxf_version": "AC1015",
        "schema": "aecctx.dwg.conversion.v2"
      },
      "sequence": 1,
      "source_locator": "dwg-artifact:converted-dxf:sha256:d668789efac18692f23f3ae1c58347b958c38a6822fafc2cae07e4f3c12205a7"
    }
  ],
  "ok": true,
  "protocol_version": "0.2",
  "provider_id": "org.aecctx.dwg.libredwg",
  "request_id": "555e48690298b4af0bc07f40a54d3c533e3fe36d897a8bd32b2dc25bc32f63dd",
  "resource_usage": {
    "artifacts": 2,
    "events": 2,
    "source_objects": 58
  }
}
