{"artifacts":[],"attestation":{"descriptor_digest":"9d349244f292c0fea9468a326e1851183c876a7780d3ffe91f00bbd154457983","deterministic":true,"enforcement_profile":"oci-docker-v1","network_mode":"disabled","provider_id":"org.aecctx.ocr.tesseract-tsv","provider_version":"0.2.0","request_digest":"551491c489fba7eff7ef62e680811e5ba61219af7235abfddb3108ad5d66b511","response_payload_digest":"b5fe138cba891ed1679c9af94f26301651408d05b67df967ab204300287f0b38","runtime_digest":"sha256:6d52ebcafef0ccdf59f58beccc7483c16a6e160fc94e3c3ea59f3f10c991f492","runtime_version":"tesseract-5.3.4+capi+eng"},"capability_report":{"2d_geometry":{"affected":["raster-input"],"fallback":"retain opaque source evidence","reason_codes":["AECCTX_OCR_CAPABILITY_UNSUPPORTED"],"support_level":"unsupported"},"3d_geometry":{"affected":["raster-input"],"fallback":"retain opaque source evidence","reason_codes":["AECCTX_OCR_CAPABILITY_UNSUPPORTED"],"support_level":"unsupported"},"georeferencing":{"affected":["raster-input"],"fallback":"retain opaque source evidence","reason_codes":["AECCTX_OCR_CAPABILITY_UNSUPPORTED"],"support_level":"unsupported"},"hierarchy":{"affected":["raster-input"],"fallback":"retain opaque source evidence","reason_codes":["AECCTX_OCR_CAPABILITY_UNSUPPORTED"],"support_level":"unsupported"},"identity":{"affected":["raster-input"],"fallback":"retain opaque source evidence","reason_codes":["AECCTX_OCR_CAPABILITY_UNSUPPORTED"],"support_level":"unsupported"},"materials_styles":{"affected":["raster-input"],"fallback":"retain opaque source evidence","reason_codes":["AECCTX_OCR_CAPABILITY_UNSUPPORTED"],"support_level":"unsupported"},"properties":{"affected":["raster-input"],"fallback":"retain opaque source evidence","reason_codes":["AECCTX_OCR_CAPABILITY_UNSUPPORTED"],"support_level":"unsupported"},"relationships":{"affected":["raster-input"],"fallback":"retain opaque source evidence","reason_codes":["AECCTX_OCR_CAPABILITY_UNSUPPORTED"],"support_level":"unsupported"},"text":{"affected":["raster-word-evidence"],"fallback":"retain source pixels and provider attestation","reason_codes":["AECCTX_OCR_INFERRED_UNVERIFIED"],"support_level":"partial"},"validation":{"affected":[],"fallback":"none","reason_codes":[],"support_level":"full"}},"diagnostics":[],"events":[{"event_type":"primitive","payload":{"height":88,"language":"eng","page_segmentation_mode":6,"schema":"aecctx.ocr.words.v1","width":520,"words":[{"bbox":[16,16,320,56],"confidence":0.0,"language":"eng","reading_order":0,"text":"AECLCTs*"},{"bbox":[400,16,88,56],"confidence":93.136063,"language":"eng","reading_order":1,"text":"15"}]},"sequence":0,"source_locator":"sha256:901aea5d7dadedeaf3b0f3ae5559d511b490c14463d2b7af3d443599838f9f1b"}],"ok":true,"protocol_version":"0.2","provider_id":"org.aecctx.ocr.tesseract-tsv","request_id":"0ba03d398835118b0a703b6e9c590e0e120e29f1022458041d6f77a1b288572c","resource_usage":{"artifacts":0,"events":1,"height":88,"width":520}}